{
  "conditions": [
    "Aprobación del propietario registrada sobre la versión 1.1.0 y el checksum exacto.",
    "La activación requiere validación técnica coincidente."
  ],
  "decision": "APPROVE",
  "approved_by": "OWNER",
  "approved_at": "2026-07-23T17:03:01+02:00",
  "evidence_summary": "Aprobación funcional del propietario registrada sobre la versión 1.1.0 y checksum exacto; compilación, validación técnica y consumo canónico verificados.",
  "functional_owner_role": "CHANNEL_INTELLIGENCE",
  "limitations": [
    "El corpus auténtico permanece vacío bajo evidencia SPECIFICATION_BASED; no se requiere audio ni transcripción."
  ],
  "profile_checksum": "dbe94dbfcee5e9e30a956dab20097f62216e4fb58beddb3ef8fa3086fd95ee8c",
  "profile_id": "mas_alla_del_guion",
  "profile_version": "1.1.0",
  "voice_evidence_level": "SPECIFICATION_BASED"
}
