{
  "profile_id": "mas_alla_del_guion",
  "profile_version": "1.2.2",
  "profile_checksum": "c4175417681eb0bc8626a8ae6933cda8cfb3f3645ce138b0e9cdbd59cf59dff9",
  "decision": "APPROVE",
  "approval_status": "APPROVE",
  "reviewer_role": "CHANNEL_INTELLIGENCE",
  "approval_timestamp": "2026-08-29T09:39:14Z",
  "review_scope": [
    "identidad estable",
    "voz autorizada",
    "checksum exacto",
    "activacion controlada"
  ],
  "functional_owner_role": "CHANNEL_INTELLIGENCE",
  "approved_by": "owner_channel_intelligence",
  "approved_at": "2026-08-29T09:39:14Z",
  "voice_evidence_level": "AUTHENTIC_CORPUS_PARTIAL",
  "evidence_summary": "Aprobacion funcional y del propietario registrada sobre mas_alla_del_guion@1.2.2 y su checksum exacto; corpus autentico parcial no validado globalmente.",
  "limitations": [
    "VOICE_CORPUS_STATE = AUTHENTIC_CORPUS_PARTIAL",
    "GLOBAL_VOICE_REPRESENTATIVENESS = NOT_VALIDATED"
  ],
  "conditions": [
    "Checksum aprobado exacto: c4175417681eb0bc8626a8ae6933cda8cfb3f3645ce138b0e9cdbd59cf59dff9",
    "La activacion no implica validacion global de voz ni autoriza ampliar el corpus sin nueva evaluacion."
  ],
  "notes": "OWNER_PROFILE_APPROVAL = APPROVED; la representatividad global de la voz permanece NOT_VALIDATED."
}
